{"claim_type":"bibliographic","evidence_ids":["ev-cbt-s5-emotional-disorders-1976"],"id":"c-cbt-s5-emotional-disorders-1976","provenance":"source_derived","publishable":true,"record_type":"claim","scope_note":"The 1976 Meridian listing is kept distinct from the 1979 International Universities Press paperbound listing.","statement":"The Beck Institute bibliography lists Aaron T. Beck's 'Cognitive Therapy and the Emotional Disorders' as a 1976 Meridian publication.","statement_zh":"Beck Institute 書目將 Aaron T. Beck 的《Cognitive Therapy and the Emotional Disorders》列為 1976 年 Meridian 出版品。","status":"verified","subject_id":"cbt"}
