{"claim_type":"definition","evidence_ids":["ev-cbt-s3-socratic-evaluation"],"id":"c-cbt-s3-socratic-evaluation","provenance":"source_derived","publishable":true,"record_type":"claim","scope_note":"The technique is collaborative evaluation, not a rule that therapists declare all difficult thoughts false.","statement":"The Beck model uses gentle Socratic questioning to help patients evaluate and respond to thoughts and beliefs and learn that process themselves.","statement_zh":"Beck 模型使用溫和的蘇格拉底式提問，協助當事人評估並回應思考與信念，也學會自行進行此過程。","status":"verified","subject_id":"cbt"}
