{
  "claim_type": "attribution",
  "evidence_ids": [
    "ev-structuralism-s2-apa-attribution"
  ],
  "id": "c-structuralism-s2-apa-attribution",
  "provenance": "source_derived",
  "publishable": true,
  "record_type": "claim",
  "scope_note": "This records the attribution boundary in a current professional reference work; it does not erase Wundt's influence on Titchener or settle every historiographical interpretation.",
  "statement": "The APA Dictionary attributes psychological structuralism more strongly and directly to Edward Bradford Titchener than to Wilhelm Wundt.",
  "statement_zh": "APA Dictionary 對心理學結構主義的歸屬，更強而直接地指向 Edward Bradford Titchener，而非 Wilhelm Wundt。",
  "status": "verified",
  "subject_id": "structuralism"
}
