{"claim_type":"definition","evidence_ids":["ev-cbt-s7-act-contextual-rft"],"id":"c-cbt-s7-act-contextual-rft","provenance":"source_derived","publishable":true,"record_type":"claim","scope_note":"The claim describes Hayes's ACT formulation; it does not generalize RFT to all third-wave or all CBT approaches.","statement":"Hayes describes ACT as explicitly contextualistic and based on Relational Frame Theory's experimental analysis of language and cognition.","statement_zh":"Hayes 將 ACT 描述為明確採脈絡主義，並以關係框架理論對語言與認知的實驗分析為基礎。","status":"verified","subject_id":"cbt"}
