{"claim_type":"bibliographic","evidence_ids":["ev-indigenous-psychology-s5-2006-edited-volume"],"id":"c-indigenous-psychology-s5-2006-edited-volume","provenance":"source_derived","publishable":true,"record_type":"claim","scope_note":"The 2006 edited synthesis is a later source and its formulations must not be projected into the 1993 volume or 2000 article without direct comparison; editor identity is separately visible on the preceding title page.","statement":"Springer's copyright page dates Indigenous and Cultural Psychology: Understanding People in Context to 2006.","statement_zh":"Springer 的版權頁將《Indigenous and Cultural Psychology: Understanding People in Context》標為 2006 年出版。","status":"verified","subject_id":"indigenous-psychology"}
