{
  "claim_type": "definition",
  "evidence_ids": [
    "ev-structuralism-s4-wundt-association-elementary"
  ],
  "id": "c-structuralism-s4-wundt-association-elementary",
  "provenance": "source_derived",
  "publishable": true,
  "record_type": "claim",
  "scope_note": "Wundt's elementary association is inferred by analysis of complex products; this is narrower than treating fixed, finished ideas as the primitive units of association.",
  "statement": "Wundt treated association as an elementary process manifested through complex products.",
  "status": "verified",
  "subject_id": "structuralism"
}
