{"claim_type":"definition","evidence_ids":["ev-cbt-s1-talking-therapy-thinking-acting"],"id":"c-cbt-s1-talking-therapy-thinking-acting","provenance":"source_derived","publishable":true,"record_type":"claim","scope_note":"This is the NHS public-service definition; it does not make every intervention that changes thought or action a CBT protocol.","statement":"The NHS defines CBT as a talking therapy in which a therapist helps a person change how they think and act.","statement_zh":"英國 NHS 將 CBT 定義為一種談話治療，由治療師協助當事人改變思考與行動方式。","status":"verified","subject_id":"cbt"}
