{
  "claim_type": "attribution",
  "evidence_ids": [
    "ev-structuralism-s2-wundt-program"
  ],
  "id": "c-structuralism-s2-wundt-program",
  "provenance": "source_derived",
  "publishable": true,
  "record_type": "claim",
  "scope_note": "This is Wundt's own programmatic label in the 1902 fifth-edition introduction; it does not by itself prove that no part of his system can be described retrospectively as structural.",
  "statement": "Wundt described his physiological psychology as experimental psychology.",
  "statement_zh": "Wundt 將自己的生理心理學描述為實驗心理學。",
  "status": "verified",
  "subject_id": "structuralism"
}
